{"$schema":"https://json-schema.org/draft/2020-12/schema","$id":"https://raw.githubusercontent.com/tooppoo/testography/main/schemas/testography-evidence/testography-evidence.v0.json","title":"Testography Evidence Artifact v0","type":"object","required":["schema_version","artifact_type","producer","evidence"],"additionalProperties":false,"properties":{"schema_version":{"$ref":"#/$defs/schema_version"},"artifact_type":{"const":"evidence"},"producer":{"$ref":"#/$defs/producer"},"project":{"type":"object","additionalProperties":true},"evidence":{"$ref":"#/$defs/evidence"},"diagnostics":{"type":"array","items":{"$ref":"#/$defs/diagnostic"}},"extensions":{"type":"object","additionalProperties":true}},"$defs":{"schema_version":{"type":"string","pattern":"^(v0|0(\\.\\d+\\.\\d+)?)$"},"id":{"type":"string","minLength":1},"confidence":{"type":"string","enum":["high","medium","low","unknown"]},"producer":{"type":"object","required":["name","version"],"additionalProperties":false,"properties":{"name":{"type":"string","minLength":1},"version":{"type":"string","minLength":1},"kind":{"type":"string"},"extensions":{"type":"object","additionalProperties":true}}},"source":{"type":"object","required":["file"],"additionalProperties":false,"properties":{"file":{"type":"string","minLength":1},"line":{"type":"integer","minimum":1},"column":{"type":"integer","minimum":1},"language":{"type":"string"},"text":{"type":"string"},"text_hash":{"type":"string"},"extensions":{"type":"object","additionalProperties":true}}},"diagnostic":{"type":"object","required":["level","producer","message"],"additionalProperties":false,"properties":{"level":{"enum":["debug","info","warning","error"]},"producer":{"type":"string"},"code":{"type":"string"},"message":{"type":"string"},"refs":{"type":"array","items":{"$ref":"#/$defs/id"}},"extensions":{"type":"object","additionalProperties":true}}},"module":{"type":"object","required":["id","kind"],"additionalProperties":false,"properties":{"id":{"$ref":"#/$defs/id"},"kind":{"enum":["file","symbol","package","class","method","function","unknown"]},"path":{"type":"string"},"container":{"type":"string"},"qualified_name":{"type":"string"},"language":{"type":"string"},"extensions":{"type":"object","additionalProperties":true}}},"value":{"type":"object","required":["value_kind"],"additionalProperties":false,"properties":{"value_kind":{"enum":["string_literal","number_literal","boolean_literal","null_literal","undefined_literal","language_specific_literal","object_literal","array_literal","identifier","call_expression","member_expression","template_literal","closure","unknown"]},"literal_class":{"enum":["empty_string","whitespace_string","non_empty_string","zero","positive_number","negative_number","integer","float","empty_array","non_empty_array","empty_object","non_empty_object","nullish","true","false","unknown"]},"syntax":{"type":"string"},"origin":{"type":"string"},"object_shape":{"type":"object","additionalProperties":{"$ref":"#/$defs/value"}},"array_items":{"type":"array","items":{"$ref":"#/$defs/value"}},"extensions":{"type":"object","additionalProperties":true}}},"call":{"type":"object","required":["id","role","callee"],"additionalProperties":false,"properties":{"id":{"$ref":"#/$defs/id"},"role":{"enum":["direct_call","assertion_target_call","setup_call","fixture_call","helper_call","factory_call","mock_setup_call","unknown_call"]},"callee":{"type":"object","required":["text","resolution_status"],"additionalProperties":true,"properties":{"text":{"type":"string"},"resolution_status":{"enum":["resolved","unresolved","ambiguous","unknown"]},"resolved_module_id":{"type":"string"},"resolved_symbol":{"type":"string"},"confidence":{"$ref":"#/$defs/confidence"}}},"source":{"$ref":"#/$defs/source"},"extensions":{"type":"object","additionalProperties":true}}},"parameter":{"type":"object","required":["id","argument_index","value_kind"],"additionalProperties":false,"properties":{"value_kind":{"enum":["string_literal","number_literal","boolean_literal","null_literal","undefined_literal","language_specific_literal","object_literal","array_literal","identifier","call_expression","member_expression","template_literal","closure","unknown"]},"literal_class":{"enum":["empty_string","whitespace_string","non_empty_string","zero","positive_number","negative_number","integer","float","empty_array","non_empty_array","empty_object","non_empty_object","nullish","true","false","unknown"]},"syntax":{"type":"string"},"origin":{"type":"string"},"object_shape":{"type":"object","additionalProperties":{"$ref":"#/$defs/value"}},"array_items":{"type":"array","items":{"$ref":"#/$defs/value"}},"extensions":{"type":"object","additionalProperties":true},"id":{"$ref":"#/$defs/id"},"call_ref":{"type":"string"},"argument_index":{"type":"integer","minimum":0}}},"assertion":{"type":"object","required":["id","style"],"additionalProperties":false,"properties":{"id":{"$ref":"#/$defs/id"},"framework":{"type":"string"},"style":{"enum":["expect_matcher","assert_function","should_style","unknown"]},"matcher":{"type":"object","additionalProperties":true,"properties":{"name":{"type":"string"},"arguments":{"type":"array","items":{"$ref":"#/$defs/value"}}}},"target_call_refs":{"type":"array","items":{"$ref":"#/$defs/id"}},"target_expression":{"type":"string"},"expected":{"$ref":"#/$defs/value"},"source":{"$ref":"#/$defs/source"},"extensions":{"type":"object","additionalProperties":true}}},"test_case":{"type":"object","required":["id","name","source"],"additionalProperties":false,"properties":{"id":{"$ref":"#/$defs/id"},"name":{"type":"string"},"suite":{"type":"array","items":{"type":"string"}},"source":{"$ref":"#/$defs/source"},"calls":{"type":"array","items":{"$ref":"#/$defs/call"}},"parameters":{"type":"array","items":{"$ref":"#/$defs/parameter"}},"assertions":{"type":"array","items":{"$ref":"#/$defs/assertion"}},"mocks":{"type":"array","items":{"type":"object","additionalProperties":true}},"fixtures":{"type":"array","items":{"type":"object","additionalProperties":true}},"extensions":{"type":"object","additionalProperties":true}}},"link":{"type":"object","required":["test_id","module_id","relationship","confidence"],"additionalProperties":false,"properties":{"test_id":{"$ref":"#/$defs/id"},"module_id":{"$ref":"#/$defs/id"},"relationship":{"enum":["directly_called","assertion_target","setup_dependency","fixture_dependency","factory_dependency","mocked_dependency","helper_dependency","unresolved_candidate","ambiguous_candidate"]},"confidence":{"$ref":"#/$defs/confidence"},"basis":{"type":"array","items":{"type":"string"}},"evidence_refs":{"type":"array","items":{"$ref":"#/$defs/id"}},"extensions":{"type":"object","additionalProperties":true}}},"module_bundle":{"type":"object","required":["module_id"],"additionalProperties":false,"properties":{"module_id":{"$ref":"#/$defs/id"},"module_ref":{"$ref":"#/$defs/module"},"tests":{"type":"array","items":{"type":"object","additionalProperties":true}},"evidence_refs":{"type":"array","items":{"$ref":"#/$defs/id"}},"extensions":{"type":"object","additionalProperties":true}}},"evidence":{"type":"object","additionalProperties":false,"properties":{"test_cases":{"type":"array","items":{"$ref":"#/$defs/test_case"}},"modules":{"type":"array","items":{"$ref":"#/$defs/module"}},"test_module_links":{"type":"array","items":{"$ref":"#/$defs/link"}},"module_bundles":{"type":"array","items":{"$ref":"#/$defs/module_bundle"}},"extensions":{"type":"object","additionalProperties":true}}}}}
