{
    "schema_version": "0.0.1",
    "artifact_type": "evidence",
    "producer": {
        "name": "test-producer",
        "version": "0.1.0",
        "kind": "static"
    },
    "evidence": {
        "test_cases": [
            {
                "id": "test-001",
                "name": "rejects empty name",
                "source": {
                    "file": "tests/user.test.ts",
                    "line": 12,
                    "language": "typescript"
                },
                "calls": [
                    {
                        "id": "call-001",
                        "role": "assertion_target_call",
                        "callee": {
                            "text": "createUser",
                            "resolution_status": "resolved",
                            "resolved_module_id": "symbol:src/user/createUser.ts#createUser"
                        }
                    }
                ],
                "parameters": [
                    {
                        "id": "param-001",
                        "argument_index": 0,
                        "value_kind": "object_literal",
                        "call_ref": "call-001"
                    }
                ],
                "assertions": [
                    {
                        "id": "assertion-001",
                        "style": "expect_matcher",
                        "target_call_refs": ["call-001"],
                        "matcher": {
                            "name": "toThrow",
                            "arguments": []
                        }
                    }
                ]
            }
        ],
        "modules": [
            {
                "id": "symbol:src/user/createUser.ts#createUser",
                "kind": "symbol",
                "path": "src/user/createUser.ts"
            }
        ],
        "test_module_links": [
            {
                "test_id": "test-001",
                "module_id": "symbol:src/user/createUser.ts#createUser",
                "relationship": "assertion_target",
                "confidence": "high",
                "evidence_refs": ["call-001"]
            }
        ]
    },
    "diagnostics": [
        {
            "level": "info",
            "producer": "test-producer",
            "message": "evidence collected",
            "code": "evidence.collected"
        }
    ]
}
